{
  "version": "2.0",
  "description": "Product-to-canonical-bioactive relationships for the current PWB product set, rebuilt against the manufacturer factsheets (Synergy WorldWide / PhytoLife / Mistify product packs). Status distinguishes ingredients declared with a specific dose (DIRECT) from constituents known to be present because they are characteristic of a named source ingredient on the label but not independently quantified (SOURCE_DEFINED).",
  "count": 91,
  "products": [
    {
      "id": "PRD001",
      "name": "Synergy ProArgi-9+",
      "bioactives": [
        {
          "id": "FC011",
          "status": "DIRECT"
        },
        {
          "id": "FC012",
          "status": "DIRECT"
        },
        {
          "id": "FC014",
          "status": "DIRECT"
        },
        {
          "id": "PP006",
          "status": "SOURCE_DEFINED"
        },
        {
          "id": "PP007",
          "status": "SOURCE_DEFINED"
        }
      ]
    },
    {
      "id": "PRD002",
      "name": "Synergy e9",
      "bioactives": [
        {
          "id": "FC011",
          "status": "DIRECT"
        },
        {
          "id": "FC009",
          "status": "DIRECT"
        },
        {
          "id": "FC027",
          "status": "SOURCE_DEFINED"
        },
        {
          "id": "PP003",
          "status": "SOURCE_DEFINED"
        },
        {
          "id": "PP001",
          "status": "SOURCE_DEFINED"
        },
        {
          "id": "FC046",
          "status": "SOURCE_DEFINED"
        },
        {
          "id": "FC047",
          "status": "SOURCE_DEFINED"
        }
      ]
    },
    {
      "id": "PRD003",
      "name": "Synergy Immune Booster",
      "bioactives": [
        {
          "id": "DF001",
          "status": "DIRECT"
        },
        {
          "id": "DF009",
          "status": "DIRECT"
        }
      ]
    },
    {
      "id": "PRD004",
      "name": "Synergy Pro360 Wholefood Greens",
      "bioactives": [
        {
          "id": "PP002",
          "status": "DIRECT"
        },
        {
          "id": "PP001",
          "status": "DIRECT"
        },
        {
          "id": "PP003",
          "status": "SOURCE_DEFINED"
        },
        {
          "id": "FC001",
          "status": "SOURCE_DEFINED"
        },
        {
          "id": "FC021",
          "status": "DIRECT"
        },
        {
          "id": "PP009",
          "status": "SOURCE_DEFINED"
        },
        {
          "id": "PP010",
          "status": "SOURCE_DEFINED"
        },
        {
          "id": "FC017",
          "status": "SOURCE_DEFINED"
        },
        {
          "id": "FC018",
          "status": "SOURCE_DEFINED"
        },
        {
          "id": "FC047",
          "status": "SOURCE_DEFINED"
        },
        {
          "id": "DF002",
          "status": "SOURCE_DEFINED"
        }
      ]
    },
    {
      "id": "PRD005",
      "name": "Synergy Pro360 Superfood Performance Beets",
      "bioactives": [
        {
          "id": "FC020",
          "status": "DIRECT"
        },
        {
          "id": "FC016",
          "status": "DIRECT"
        },
        {
          "id": "DF009",
          "status": "DIRECT"
        },
        {
          "id": "PP003",
          "status": "SOURCE_DEFINED"
        },
        {
          "id": "PP006",
          "status": "SOURCE_DEFINED"
        },
        {
          "id": "PP001",
          "status": "SOURCE_DEFINED"
        },
        {
          "id": "PP008",
          "status": "SOURCE_DEFINED"
        },
        {
          "id": "FC001",
          "status": "SOURCE_DEFINED"
        },
        {
          "id": "OS003",
          "status": "SOURCE_DEFINED"
        },
        {
          "id": "PP007",
          "status": "SOURCE_DEFINED"
        },
        {
          "id": "PP013",
          "status": "SOURCE_DEFINED"
        },
        {
          "id": "PP014",
          "status": "SOURCE_DEFINED"
        },
        {
          "id": "PP015",
          "status": "SOURCE_DEFINED"
        }
      ]
    },
    {
      "id": "PRD006",
      "name": "Synergy Biome Actives",
      "bioactives": [
        {
          "id": "DF003",
          "status": "DIRECT"
        }
      ]
    },
    {
      "id": "PRD007",
      "name": "Synergy Biome DT",
      "bioactives": [
        {
          "id": "DF011",
          "status": "DIRECT"
        },
        {
          "id": "FC013",
          "status": "DIRECT"
        },
        {
          "id": "DF003",
          "status": "DIRECT"
        },
        {
          "id": "FC021",
          "status": "DIRECT"
        },
        {
          "id": "PP003",
          "status": "SOURCE_DEFINED"
        },
        {
          "id": "FC001",
          "status": "SOURCE_DEFINED"
        },
        {
          "id": "OS003",
          "status": "SOURCE_DEFINED"
        },
        {
          "id": "FA001",
          "status": "SOURCE_DEFINED"
        },
        {
          "id": "PP013",
          "status": "SOURCE_DEFINED"
        },
        {
          "id": "PP014",
          "status": "SOURCE_DEFINED"
        }
      ]
    },
    {
      "id": "PRD008",
      "name": "Synergy Biome Shake",
      "bioactives": [
        {
          "id": "DF012",
          "status": "DIRECT"
        },
        {
          "id": "DF009",
          "status": "DIRECT"
        },
        {
          "id": "PP003",
          "status": "SOURCE_DEFINED"
        },
        {
          "id": "FC001",
          "status": "DIRECT"
        },
        {
          "id": "FC020",
          "status": "SOURCE_DEFINED"
        },
        {
          "id": "FA001",
          "status": "SOURCE_DEFINED"
        },
        {
          "id": "PP008",
          "status": "SOURCE_DEFINED"
        },
        {
          "id": "PP012",
          "status": "SOURCE_DEFINED"
        }
      ]
    },
    {
      "id": "PRD009",
      "name": "Synergy Body Prime",
      "bioactives": [
        {
          "id": "DF002",
          "status": "DIRECT"
        }
      ]
    },
    {
      "id": "PRD010",
      "name": "PhytoLife",
      "bioactives": [
        {
          "id": "FC021",
          "status": "DIRECT"
        },
        {
          "id": "TP002",
          "status": "DIRECT"
        }
      ]
    },
    {
      "id": "PRD011",
      "name": "Mistify",
      "bioactives": [
        {
          "id": "PP001",
          "status": "DIRECT"
        },
        {
          "id": "PP006",
          "status": "SOURCE_DEFINED"
        },
        {
          "id": "PP007",
          "status": "SOURCE_DEFINED"
        },
        {
          "id": "PP003",
          "status": "SOURCE_DEFINED"
        }
      ]
    },
    {
      "id": "PRD012",
      "name": "Synergy Collagen+",
      "bioactives": [
        {
          "id": "FC041",
          "status": "DIRECT"
        },
        {
          "id": "FC042",
          "status": "DIRECT"
        }
      ]
    },
    {
      "id": "PRD013",
      "name": "Synergy Collagen+ Beauty",
      "bioactives": [
        {
          "id": "FC041",
          "status": "DIRECT"
        },
        {
          "id": "FC042",
          "status": "DIRECT"
        },
        {
          "id": "PP006",
          "status": "DIRECT"
        },
        {
          "id": "CA001",
          "status": "DIRECT"
        },
        {
          "id": "PP007",
          "status": "SOURCE_DEFINED"
        }
      ]
    },
    {
      "id": "PRD014",
      "name": "Synergy FL-3X",
      "bioactives": [
        {
          "id": "FC043",
          "status": "DIRECT"
        },
        {
          "id": "FC044",
          "status": "DIRECT"
        },
        {
          "id": "FC045",
          "status": "DIRECT"
        },
        {
          "id": "PP003",
          "status": "SOURCE_DEFINED"
        },
        {
          "id": "PP013",
          "status": "SOURCE_DEFINED"
        }
      ]
    },
    {
      "id": "PRD015",
      "name": "Synergy Vitamin D3",
      "bioactives": []
    },
    {
      "id": "PRD016",
      "name": "Synergy Omega-3",
      "bioactives": [
        {
          "id": "FA002",
          "status": "DIRECT"
        },
        {
          "id": "FA003",
          "status": "DIRECT"
        }
      ]
    },
    {
      "id": "PRD017",
      "name": "Synergy CoQ10",
      "bioactives": [
        {
          "id": "FC008",
          "status": "DIRECT"
        }
      ]
    },
    {
      "id": "PRD018",
      "name": "Synergy Liver Health",
      "bioactives": [
        {
          "id": "FC001",
          "status": "DIRECT"
        },
        {
          "id": "FC015",
          "status": "SOURCE_DEFINED"
        },
        {
          "id": "PP011",
          "status": "SOURCE_DEFINED"
        }
      ]
    },
    {
      "id": "PRD019",
      "name": "Synergy Zinc Protect",
      "bioactives": [
        {
          "id": "TP003",
          "status": "SOURCE_DEFINED"
        }
      ]
    },
    {
      "id": "PRD020",
      "name": "Synergy SleepWell",
      "bioactives": [
        {
          "id": "FC049",
          "status": "DIRECT"
        },
        {
          "id": "FC050",
          "status": "SOURCE_DEFINED"
        },
        {
          "id": "FC051",
          "status": "SOURCE_DEFINED"
        }
      ]
    },
    {
      "id": "PRD021",
      "name": "Synergy Multivitamin",
      "bioactives": [
        {
          "id": "DF009",
          "status": "DIRECT"
        },
        {
          "id": "CA004",
          "status": "DIRECT"
        }
      ]
    },
    {
      "id": "PRD022",
      "name": "Synergy Carb Blocker",
      "bioactives": [
        {
          "id": "FC048",
          "status": "DIRECT"
        }
      ]
    },
    {
      "id": "PRD023",
      "name": "Synergy Fat Grabber",
      "bioactives": [
        {
          "id": "DF011",
          "status": "DIRECT"
        },
        {
          "id": "DF007",
          "status": "DIRECT"
        }
      ]
    }
  ]